{
  "id": "multi-agent-orchestration",
  "name": "Multi-Agent Orchestration System",
  "description": "A pattern for building systems where multiple specialized agents collaborate under an orchestrator to solve complex tasks. Each agent handles specific responsibilities while the orchestrator coordinates their interactions and manages the overall workflow.",
  "version": "1.0.0",
  "pattern_type": "orchestration",
  "frameworks": [
    {
      "id": "langraph",
      "name": "LangChain + LangGraph",
      "path": "src/langraph",
      "description": "LangGraph framework for building stateful, multi-actor agent systems"
    }
  ],
  "deployment_patterns": [
    {
      "id": "terraform",
      "name": "Terraform",
      "description": "Infrastructure as Code using Terraform for AWS deployment",
      "path": "iac/terraform"
    }
  ],
  "parameters": [
    {
      "name": "project_name",
      "type": "string",
      "description": "Name of your project (lowercase, alphanumeric, hyphens only)",
      "required": true,
      "pattern": "^[a-z][a-z0-9-]{2,49}$"
    },
    {
      "name": "aws_region",
      "type": "string",
      "description": "AWS region for deployment",
      "required": false,
      "default": "us-east-1",
      "enum": [
        "us-east-1",
        "us-east-2",
        "us-west-1",
        "us-west-2",
        "eu-west-1",
        "eu-central-1",
        "ap-southeast-1",
        "ap-northeast-1"
      ]
    },
    {
      "name": "num_agents",
      "type": "integer",
      "description": "Number of specialized agents (2-10)",
      "required": false,
      "default": 2,
      "minimum": 2,
      "maximum": 10
    },
    {
      "name": "langfuse_host",
      "type": "string",
      "description": "Langfuse server endpoint URL for observability",
      "required": false,
      "default": "https://cloud.langfuse.com"
    },
    {
      "name": "langfuse_secret_name",
      "type": "string",
      "description": "Secrets Manager secret name for Langfuse API keys",
      "required": false,
      "default": ""
    },
    {
      "name": "llm_model",
      "type": "string",
      "description": "LLM model for the agent",
      "required": false,
      "default": "anthropic.claude-haiku-4-5-20251001-v1:0",
      "enum": [
        "anthropic.claude-haiku-4-5-20251001-v1:0",
        "anthropic.claude-3-5-sonnet-20241022-v2:0",
        "anthropic.claude-3-haiku-20240307-v1:0",
        "amazon.nova-pro-v1:0",
        "amazon.nova-lite-v1:0"
      ]
    }
  ],
  "example_use_cases": [
    "Multi-agent collaboration systems",
    "Complex workflows requiring agent specialization",
    "Parallel task processing with coordination",
    "KYC analysis with credit and compliance agents",
    "Document processing with analysis and validation agents",
    "Customer support with routing and specialist agents"
  ],
  "author": "AVA Team",
  "license": "Apache-2.0",
  "tags": [
    "multi-agent",
    "orchestration",
    "collaboration",
    "langraph",
    "coordination"
  ],
  "type": "usecase",
  "outputs": {
    "orchestrator_endpoint": "Orchestrator invocation endpoint",
    "runtime_id": "Runtime identifier"
  },
  "jobs": [
    {
      "name": "onboarding",
      "incoming_event": "multi_agent_onboarding_request",
      "outgoing_event": "multi_agent_onboarding_success"
    },
    {
      "name": "offboarding",
      "incoming_event": "multi_agent_offboarding_request",
      "outgoing_event": "multi_agent_offboarding_success"
    }
  ],
  "dependencies": [
    "foundation-stack"
  ]
}